Aber was bedeutet das eigentlich?;text_Wörtlich übersetzt bedeutet Open Source offene Quelle und steht in der Softwareentwicklung für Programme, deren Quellcode für jeden zugänglich ist. Das bedeutet, jeder kann den Quellcode einsehen und gegebenenfalls sogar bearbeiten, weiterverwenden etc.;text_Open Source ist allerdings nicht nur ein Begriff der Softwareentwicklung. Es gibt viele Open Bewegungen. Das bekannteste Beispiel ist wohl Wikipedia. Auch wenn es hier nicht um Software geht, folgt es dem gleichen Gedanken. Offene Informationen für alle. Jeder kann lesen und bearbeiten.;;;;;;;;;
Daily Lections;Privacy Paradox;0;-99;1;0;text_Keine Ahnung was das ist? Macht nichts, wir erklären es! Du nutzt sicher einige Apps, Programme, soziale Medien etc.. Manchmal merkst du überhaupt nicht, welche Daten diese Dienste von dir fordern und speichern und sicherlich ärgert dich diese Erkenntnis. Niemals würdest du sensible Daten freiwillig preisgeben, immerhin ist dir deine Privatsphäre ja wichtig!;text_Genauso wichtig ist es aber auch, in facebook mal seinen Standort zu teilen, mit Whatsapp zu telefonieren oder Ähnliches? Viele Dienste sind einfach zu hilfreich und aus der täglichen Nutzung nicht mehr wegzudenken. Genau diesen Zwiespalt beschreibt das Privacy Paradox.;;;;;;;;;;
Daily Lections;Sascha Lobo;0;-99;1;0;text_Schrill, auffällig, direkt, ehrlich. Adjektive, die auf Sascha Lobo zutreffen. Seit 2011 erscheint seine Kolumne S.P.O.N - Die Mensch-Maschine wöchentlich beim Spiegel, er ist Pirat erster Minuten und ist einer der bekanntesten Autoren zu den Themen Internet und digitalen Technologien.;text_Insbesondere beschäftigt er sich mit der Auswirkung dieser Themen auf die Gesellschaft. Mit seine Artikel und Publikationen polarisiert er häufig, denn sein offener, selbstironischer Stil gefällt nicht jedem. Wir haben dir einen interessanten Artikel verlinkt!
http://www.spiegel.de/netzwelt/web/zugriff-auf-daten-bequemlichkeit-schlaegt-sicherheit-kolumne-a-1114091.html;;;;;;;;;;
Daily Lections;Schnüffeln verboten;0;-99;1;0;text_Du möchtest mehr über die Ausnutzung von App-Berechtigungen erfahren? Hier ein kleiner Artikel der ZEIT ONLINE zu diesem Thema!
http://www.zeit.de/2014/19/schnueffel-apps-datenschutz-klagen;;;;;;;;;;;
Daily Lections;Serienempfehlung: Person of Interest;0;-99;1;0;text_Eine künstliche Intelligenz, die Daten aus Überwachungssystemen analysiert und dazu nutzt, präzise Vorhersagen bezüglich kommender Ereignisse zu treffen. Ein schmaler Grad zwischen legal und illegal, moralisch und unmoralisch.;text_Verbrechen, korrupte Polizisten und ein Gutmensch. Die Kombination ergibt eine packende, interessante und nachdenklich machende Serie über Spionage, Big Data, künstliche Intelligenz und die Anfänge eines Überwachungsstaates.;;;;;;;;;;
Daily Lections;TrueCrypt;0;-99;1;0;text_Hast du dir schon einmal Gedanken darüber gemacht, dass deine Daten (falls du einen Windows Rechner nutzt) nur durch dein Passwort des Windows Benutzerkontos geschützt sind (wenn du dies überhaupt eingerichtet hast). Falls nicht, ist es auf jeden Fall an der Zeit! Ein einfaches und effektives Tool hierfür ist TrueCrypt.;text_Es ist ein Verschlüsselungs-Werkzeug und verfügt über umfangreiche Möglichkeiten, seine Daten vor Zugriffen zu schtzen. Es lassen sich einzelne Dateien, Partitionen, Laufwerke und Ordner verschlüsseln. Zusätzlich lässt sich das ganze System vor unbefugtem Zutritt sichern, indem das Betriebssystem nur mit korrektem Passwort startet.;;;;;;;;;;
Daily Lections;Wahlkampf Big Data;0;-99;2;0;text_Am 8. November 2016 haben die USA Donald Trump zu ihrem neuen Präsidenten gewählt. Für viele ein riesiger Schock und unbegreiflich. Sah es doch zunächst in allen Prognosen so aus, als würde sich seine Rivalin Hillary Clinton durchsetzen und damit hätten sich die meisten sicherlich anfreunden können.;text_Einen guten Monat später geht ein Aufschrei durch die Presse. Trump hat wohl die Firma Cambridge Analytica für sich arbeiten lassen und sein Erfolg bei der Wahl scheint eng hiermit verknüpft zu sein. Cambridge Analytica hat mithilfe von Big Data psychologische Nutzerprofile für Wähler erstellt und darauf aufbauend passende Trump Werbung geschaltet.;text_Wähler haben das zu sehen bekommen, was sie wollten. Ob das Manipulation ist, muss jeder für sich selbst entscheiden? Fakt ist: Cambridge Analytica war auch an der Brexit-Kampagne beteiligt.;text_P.S. Big Data bezeichnet Datenmengen, die sehr schnell wachsen und unendlich groß sind. Sie sind zu komplex um sie herkömmlich zu analysieren, schafft man dies jedoch, können sehr viele Informationen aus ihnen erschlossen werden.;;;;;;;;
Daily Lections;Zitat: Tim Cook;0;-99;1;0;text_Wenn Sie für die Polizei einen Schlüssel unter die Fußmatte legen, kann ihn auch ein Einbrecher dort finden. Kriminelle verwenden jede Technologie, die ihnen zur Verfügung steht, um sich in die Konten der Menschen zu hacken. Wenn sie wissen, dass irgendwo ein Schlüssel versteckt ist, werden sie nicht ruhen, bis sie diesen gefunden haben.;text_Aus einer Rede zu Privatsphäre und Sicherheit von Tim Cook, CEO von Apple, 2015;;;;;;;;;;
