Facebook;Tipps und Tricks;3600000;0;5;0;text_Wie wir gesehen haben haben, ist facebook wirklich eine Datenkrake! Nun wollen wir kurz zusammenfassen, worauf es sich lohnt zu achten um gegebenenfalls ab und an aktiv zu werden. Zur Verbesserung des eigenen Datenschutzes!
;text_facebook ändert häufig in der Weiterentwicklung darauf verzichtet, seine Nutzer darauf hinzuweisen oder eine Einwilligung abzuholen, dass sie die Voreinstellungen geändert haben.
Die neuen Features tragen meinst den Radius “Öffentlich”, damit möglichst viele Nutzer viele Informationen sehen. Es ist demnach ratsam, sich aktiv darüber zu informieren, welche Dienste facebook freischaltet und welchen Änderungen dies mit sich trägt.
Also: Privatsphären-CheckUp durchführen!;text_facebook greift häufig auf Standorte seiner Nutzer zurück. Überprüfe die Einstellungen deiner Ortungs- oder GPS-Dienste.;text_Zielgruppengerechte Werbung und Informationen, die außerhalb von facebook von Unternehmen über mich gesammelt werden? Nehme die Werbeanzeigen-Einstellungen genauer unter die Lupe!;;;;;;;;
Facebook;Quiz;7200000;0;5;4;quiz4_1_Wie gelangt man zu den Privatsphäre-Einstellungen?_Links in der Leiste mit allen Apps und Diensten_false_Oben rechts auf dem kleinen Schloss_true_facebook hat keine Privatsphäre-Einstellungen_false_Auf der Startseite werden sie direkt angezeigt_false;quiz4_2_Wo kann man einstellen, wer meine Beiträge sehen kann?_Gar nicht, Posts sind immer öffentlich_false_In den Privatsphäre-Einstellungen_true_Beiträge können immer nur meine Freunde sehen_false_Vor jedem Post kann man selbst entscheiden, welche Zielgruppe die Inhalte sehen darf_true;quiz4_ 3_facebook verwendet immer die bestmöglichen Voreinstellungen für seine Nutzer._Ja, die Voreinstellungen sind unbedenklich_false_Bei manchen Einstellungen lohnt es sich, über die bestmögliche Einstellung für sich persönlich nachzudenken._true_Nein, häufig wählt facebook “Öffentlich” für Einstellungen._true_facebook ändert häufig die Einstellungen, ohne Nutzer darauf hinzuweisen.Ein Besuch der Einstellungen lohnt sich auch dann, wenn man schon die persönlichen Präferenzen gewählt hat._true;quiz4_3_Welche Informationen hat facebook über mich (auch wenn ich sie nicht explizit preisgegeben habe)?_mein heutiges Mittagessen._false_
Die Marke meines Autos._true_Welche Kreditkarten ich nutze._true_Beziehungsstatus_true;quiz4_2_Werbeanzeigen…_...werden dazu genutzt personalisierte Werbung zu schalten_true_...nutzt nur facebook_false_...können auch externe Anbieter auf facebook schalten_true_...sind unbedenklich_false;certificate_Sehr gut! Jetzt hast du einiges über facebook gelernt. Wir hoffen, du bleibst dran und schaust auch weiterhin ab und zu mal bei deinen Einstellungen vorbei._Ups, schau lieber nochmal genau nach und versuch es später noch einmal._8;;;;;;
Google;Let me google it...;0;1;3;0;text_Wo ist der nächste Zahnarzt? Wie kann ich meinen Fahrradreifen reparieren? Wo ist ein bestimmtes Produkt gerade am günstigsten?;text_Das und noch viel mehr sind Fragen, die wir heutzutage am ehesten einem Stellen: Google.
Aber hast du schon einmal darüber nachgedacht, was passiert nachdem du gegoogelt hast? Bleiben meine Suchanfragen erhalten? Was weiß Google danach über mich? Damit wollen wir uns hier beschäftigen.
;text_Google stellt ein Tool bereit, mit dem man seine Privatsphäre überprüfen kann. Das schauen wir uns in der Lektion “Privatsphärecheck” genauer an.;text_Außerdem gibt es eine Vielzahl an Diensten von Google, die wir wie selbstverständlich nutzen. Allerdings sind auch diese Dienste enorme Datenfresser, genau wie Googles Kernkompetenz: Die Suche. Auch das betrachten wir genauer.;;;;;;;
Google;PrivatsphäreCheck;3600000;0;5;0;text_ Wenn du ein Konto bei Google hast, dann hat Google Informationen über dich. Soweit so gut, aber welche Informationen? Am einfachsten findest du das heraus, indem du das Tool “PrivatsphäreCheck” von Google direkt mal ausprobierst.;text_Du findest es, indem du als eingeloggter User oben rechts auf dein Bild klickst und “Datenschutz” auswählst. Das bringt dich direkt zu den Datenschutzbestimmungen, wir klicken aber munter weiter zu “mein Konto” oben rechts und finden dann mittig unter Persönliche Daten und Privatsphäre den PrivatsphäreCheck.;text_Was macht das Tool? Googles Beschreibung ist die Folgende: “Überprüfen und aktualisieren Sie, welche Daten Google verwendet, um Ihre Nutzererfahrung zu personalisieren. Passen Sie an, welche Informationen Sie mit Freunden teilen oder veröffentlichen möchten.”;text_Google führt dich nun durch verschiedene Punkte in deinen Einstellungen (ähnlich wie facebook, falls du diesen Kurs schon bearbeitet hast). Relevant sind unter anderem: App & Webaktivitäten, YouTube Suchverlauf, Standortverlauf, Sprach & Audioaktivitäten, sowie Geräteinformationen von deinen genutzten Geräten.;text_Der dritte und leider auch schon letzte Punkt beschäftigt sich mit relevanten Werbeanzeigen für dich. Genaue Informationen kann man hieraus jedoch auch nicht ziehen. Es lohnt sich, über “Einstellungen für Werbung verwalten” auch mal die Themen anzuschauen, die Google für dich relevant hält, und woher diese Daten kommen.;text_Hast du zum Beispiel nie bei Google dein Geschlecht und dein Alter angegeben? Und dennoch kann Google klassifizieren, ob du männlich oder weiblich bist und eine Altersspanne für dich angeben.;;;;;;
Google;Google Dienste;3600000;0;5;0;text_Google Dienste, das sind zum Beispiel Maps mit Standortbestimmung, die Google Suche, die aufgerufenen Seiten einer Suche oder deine Aktivität im PlayStore vom Smartphone aus.;text_Sofern du die Standortbestimmungen nicht deaktiviert hast, speichert Google alle deine Wege und Aufenthaltsorte. Daraus bestimmt Google mögliche nächste Wege oder interessante Orte für dich. Um es einmal ganz anschaulich zu machen: Du kannst diese Daten herunterladen und das sogar schon graphisch ausgewertet. Stell dir eine Weltkarte vor, auf der alle Orte markiert sind, an denen Google dich getrackt hat. Unglaublich!;text_Es ist wirklich erstaunlich, wie viel Google mit seinen Nutzern teilt, man muss nur auf die Suche danach gehen.
Slide: Auch der PlayStore speichert viele Daten, denn hier generierst du auch sehr viele relevante Daten. Installierte Apps, gesuchte Apps etc. geben schon viele Informationen über dich preis.;text_Apps, die im PlayStore landen sind auch nicht immer unbedenklich. Auch viele Apps sammeln Daten über dich (schau doch mal in der App-Übersicht unserer Analyse vorbei).
Aber: Abhilfe wurde geschaffen. Und zwar in Form von alternativen App Stores. Ein Beispiel ist F-Droid.;text_F-Droid ist ein Store für Android Apps. Das Konzept ist “Free and Open-Source”, was bedeutet, die Nutzung des Stores ist kostenlos und durch das Open-Source konzept auch sehr transparent und nutzerfreundlich.;text_Apps, die auf F-Droid veröffentlicht werden, müssen zwei Kriterien erfüllen, die genau dem Konzept entsprechen. Alle Apps sind Open-Source (Programmcode frei zugänglich) und kostenlos. Außerdem werden alle Apps auf Datenschutz und Sicherheit geprüft, bevor sie in den Store aufgenommen werden.;text_Ein weiterer Vorteil: Nutzer müssen kein Konto anlegen, um Apps downloaden zu können. Apps, die zwar den Richtlinien von F-Droid entsprechen, aber dennoch Daten von Nutzern erheben, werden markiert. Ein Blick auf den alternativen Store lohnt sich in jedem Fall!;;;;;
Google;Daten, die Google sammelt;3600000;0;5;0;text_Google sammelt nicht einfach nur Daten über dich. Google kombiniert diese geschickt und erstellt hiermit detaillierte Profile. Warum Nutzerprofile kritisch sein können, erfährst du in einem anderen Kurs. Hier erfährst du, wie Google Daten über dich sammelt.
;text_Die Nutzungsbedingungen von Google akzeptierst du nicht nur erst, sobald du ein Google Konto hast. Auch schon, wenn du etwas einfach nur “googelst” erklärst du dich damit einverstanden, Google Daten über dich preis zu geben.;text_Standardmäßig hast du ein Google Konto, wenn du ein Android Smartphone hast. Zum Beispiel um Apps aus dem PlayStore zu laden. Oder aber auch, wenn du eine E-Mail Adresse, bspw. mit gmail.com als Ende. Oder du nutzt Google Drive um an einem Projekt zu arbeiten. Ein Google Konto ist für viele Nutzer aus dem Alltag kaum noch weg zu denken.
;quiz4_3_Google hat viele große Datenquellen. Was meinst du, welche gehören dazu?_Persönliche Daten_true_Apps und Anwendungen, die ich nutze_false_Deine Aktivitäten_true_Von dir erstellte Inhalte (Kontakte, Termine…)_true;text_Das kommt dir so vor als wären es alle Daten die man nur sammeln kann? Stimmt auch irgendwie!;text_Persönliche Daten und Aktivitäten, sind von dir selbst erstellte Daten. Name, E-Mail Adresse, Telefonnummer und als Android-Nutzer sogar eine Kreditkartennummer. Aber auch Termine, Mails, Notizen, Sprachbefehle und eingetippte Suchanfragen, alles Daten die du selbst generierst und die Google speichert.;text_Google erfasst aber auch Daten ohne dein Zutun. Hier eine kleine Liste:-lb-das verwendete Betriebssystem-lb-Gerätetyp-lb-Bildschirmgröße-lb-IP Adresse-lb-Telefonnummer über die SIM Karte;text_Mit den letzten beiden kann Google dauerhaft identifizieren um welches Gerät es sich handelt und somit alle gesammelten Daten zusammenführen.;text_Besonders heikle Informationen auf deinem Smartphone sind jegliche Telekommunikationsmetadaten. Dazu zählen die eigene Telefonnummer, die Anrufernummer, Weiterleitungsnummern, Datum und Uhrzeit von Anrufen, Dauer von Anrufen, SMS-Routing-Informationen und Art der Anrufe (entnommen aus der Datenschutzerklärung).;text_Alles in Allem kann jeder Nutzer selbst festlegen, welche Daten Google speichern darf. Es ist möglich, alle Daten einzusehen,zu löschen und deren Erhebung zu unterbinden. Was das “unterbinden” jedoch letztendlich bewirkt, lässt Google offen...;;;;
Google;Quiz;7200000;0;5;4;quiz4_3_ Was kann/ist Google?_Suchmaschine_true_Mail Provider_true_Smartphone Hersteller_true_Telefonanbieter_false;quiz4_3_Welche Daten kennt Google?_Gewicht_false_Name_true_Kontakte auf dem Smartphone_true_Beziehungsstatus_true
;quiz4_2_Der PrivatsphäreCheck…_...macht alle meine Daten sicher_false_...führt Nutzer durch einen kleinen Teil an relevanten Einstellungen_true_...erklärt mir ausführlich Werbeanzeigen_false_...bringt nur in Verbindung mit weiterführender Recherche wirklich etwas_true
;quiz4_3_Apps und der PlayStore von Google..._...benötigen häufig viele Permissions und erheben viele Daten_true_...sind meist unbedenklich_false_...können oft auch in F-Droid als datenschutzfreundlichere Alternative gefunden werden_true_vereinfachen vieles auf dem Smartphone_true
;quiz4_1_Wie häufig wird der Standort eines Android Users von vielen populären Apps abgefragt?_Alle vier Minuten_true_Alle 20 Minuten_false_Nur, wenn der Standort benötigt wird_false_Nur, wenn der Nutzer aktiv zustimmt_false;;;;;;;
Berechtigungen;Better ask for Permission!;0;1;1;0;text_App-Berechtigungen - Nach welchem Prinzip funktionieren sie?-lb--lb-
Wenn sich ein Nutzer eine App herunterlädt, wird er meist aufgefordert der App bestimmte Berechtigungen (Permissions) zu erteilen. Eine App sollte eigentlich nur auf für ihren Zweck nötige Ressourcen zugreifen können. Beim Durchlesen der Permissions stellt man jedoch häufig fest, dass viele davon für die eigentliche Funktionalität einer App gar nicht nötig sind.
Dementsprechend stellen sich mehrere Fragen:-lb--lb-
1. Wie funktionieren Berechtigungen?-lb-
2. Was passiert mit den zusätzlich erhobenen Daten?-lb-
3. Wie kann man Berechtigungen einschränken, ohne an Funktionalität einzubüßen? (Eine App für die Navigation wird nunmal oft den Standort benötigen);-lb-
text_Bei Android-Systemen werden Berechtigungen in „Gruppen“ eingefordert, wobei jeder Gruppe mehrere Berechtigungen zugeordnet sind. Stimmt man der Berechtigungs-Gruppe „SMS-Nachrichten“ zu, so erlaubt man einer App zwei Dinge, nämlich sowohl das Lesen als auch das Schreiben von SMS. Auf der folgenden Seite siehst du eine Auflistungen dieser Berechtigungs-Gruppen bzw. Kategorien.-lb-
;text_Berechtigungs-Gruppen:-lb--lb-
In-App-Käufe-lb-
Geräte- und App-Verkauf-lb-
Einstellungen für Mobilfunkdaten-lb-
Identität-lb-
Kontakte-lb-
Kalender-lb-
Standort-lb-
SMS-Nachrichten-lb-
Telefon-lb-
Fotos/Medien/Dateien-lb-
Kamera-lb-
WLAN-Verbindungsinformationen-lb-
Informationen zur Bluetooth-Verbindung-lb-
Wearable-Sensorendaten/ -Aktivitätsdaten-lb-
Geräte-ID und Anruferinformationen-lb-
Sonstiges-lb-
-lb-
Eine Erklärung einzelner Kategorien findest du zum Beispiel in folgendem Artikel:-lb-
https://www.netzwelt.de/news/150834-android-app-berechtigungen-einfach-erklaert.html;text_Was genau für eine App „normal”ist muss im Einzelfall untersucht werden. Im Playstore kann man bei einem Eintrag einer App ganz nach unten scrollen und sich unter dem Punkt “Berechtigungsdetails” die genauen Informationen durchlesen. Nun bleibt es einem oft selbst überlassen, sich zu überlegen, ob die eingeforderten Permissions verhältnismäßig sind.;;;;;;;;
Berechtigungen;Permission denied x;0;0;1;0;text_In der folgenden Lektion stellen wir dir ein paar Möglichkeiten vor, wie du unnötige Berechtigungen von Apps aufheben kannst.
Interessiert? Na dann los!;text_Unter “Einstellungen” - “App-Berechtigungen” lassen sich ab Android 6.0 Marshmallow nun gezielt Berechtigungen entziehen. Für ältere Versionen kannst du dir die App “App-Ops” herunterladen. Alternativ kann man sein Handy auch rooten und weitere Einstellungen vornehmen.;;;;;;;;;;
Berechtigungen;Permission Precision;3600000;0;1;4;Quiz4_1_Kannst du die Berechtigungen von Apps einschränken?_Nur wenn ich mein Handy roote_false_Ja, auch dafür gibt es Einstellungen und Apps_true_Apps benötigen generell keine Berechtigungen_false_Apps benötigen keine Berechtigungen_false;Quiz4_1_Welche Berechtigungen verbergen sich hinter der Berechtigungs-Gruppe “Sonstiges”?_SMS versenden_false_Alle Berechtigungen, die keiner anderen Kategorie zugewiesen werden können_true_Auf Kontakte zugreifen_false_Keine_false;Quiz4_2_Welche der folgenden Apps helfen dir dabei, Berechtigungen einzuschränken?_Appmania_false_Permission Friendly Apps_true_App-Topia_false_App Detective_true;Quiz4_1_Habe ich einer App bestimmte Berechtigungen eingeräumt, werden bei einem automatischen Update…_Berechtigungen bereits autorisierter Kategorien nicht erneut erwähnt_true_Erneut alle bisherigen Berechtigungen eingeholt_false_Alle neuen Berechtigungen einzeln angezeigt. Das Update wird erst durchgeführt, wenn der Nutzer die neuen Berechtigungen akzeptiert_false_Alle neuen Berechtigungen ignoriert_false;;;;;;;;
Datenschutzgesetze;Begriffsbestimmung;0;1;1;0;text_Bevor wir uns der gesetzlichen Lage zuwenden, definieren wir ein paar Begriffe aus dem Bereich Datenschutz. Zuerst unterscheiden wir zwischen zwei ähnlich wirkenden Begriffen, die jedoch ganz unterschiedliche Dinge bezeichnen.;text_(Datensicherheit)-lb-Bei Datensicherheit geht es darum, den Schutz der Daten zu gewährleisten. So möchte man verhindern, dass Unberechtigte Zugang erhalten, Daten gestohlen werden oder durch technische Ausfälle verloren gehen.;text_-Datenschutz--lb-Beim Datenschutz hingegen steht der Schutz der Privatsphäre des Menschen im Mittelpunkt. Zentral ist hierbei die “Informationelle Selbstbestimmung”. ;text_-Informationelle Selbstbestimmtheit--lb-Hiermit ist gemeint, dass das Erheben personenbezogener Daten erst einmal verboten ist. Zum Sammeln persönlicher Daten ist die Einwilligung des Betroffenen einzuholen. Unter bestimmten Umständen gibt es Ausnahmen dieser Regelungen.;;;;;;;;
Datenschutzgesetze;Data-Check;3600000;0;1;4;quiz4_2_Datenschutz ist..._Ländersache_true_Im Bundesdatenschutzgesetz geregelt_true_Explizit Teil des Grundgesetzes_false_Wichtig, aber nicht gesetzlich geregelt_false;Quiz4_4_Zu personenbezogenen Daten gehören…_Krankendaten_true_Autokennzeichen_true_Augenfarbe_true_Familienstand_true
;Quiz4_3_Wichtige Aspekte des BDSG sind..._Datenvermeidung und Datensparsamkeit_true_Regelungen zu Ausnahmen_true_Informationelle Selbstbestimmung_true_Datenüberflussgenerierung_false;quiz4_1_Wenn ich meine Einwilligung zur Erhebung meiner Daten nicht gebe, dann…_Kann dies auch nicht umgangen werden_false_Kann dies in Ausnahmefällen umgangen werden_true_Zählt dies nur im gewerblichen Bereich_false_Zählt dies nur im öffentlichen Bereich_false;;;;;;;;
Datenschutzgesetze;Einführung in die Gesetzeslage;0;0;1;0;text_In Deutschland gibt es verschiedene Gesetze. Zum einen haben die Länder ihr jeweils eigenes Landesdatenschutzgesetz, welches regelt, wie die Ämter mit personenbezogenen Daten umzugehen haben. Zum anderen gibt es das Bundesdatenschutzgesetz, welches sowohl gewerblich als auch staatlich gilt.;text_BDSG - Bundesdatenschutzgesetz-lb-
Hier wird der Datenschutz für öffentliche Stellen des Bundes und nicht-öffentliche Stellen geregelt. Geheimhaltungspflichten bleiben jedoch unberührt. Die gesamte Ausgabe ist unter folgendem Link zu finden:
https://www.gesetze-im-internet.de/bdsg_1990/index.html#BJNR029550990BJNE001302301;text_Gemäß Paragraph 6 des BDSG hat jeder das Recht Auskunft darüber zu erhalten, welche Informationen durch welche Quelle zu welchem Zweck über ihn gespeichert werden.
Dies kann jedoch durch öffentliches Interesse oder z.B. Firmeninteresse mit Begründung abgelehnt werden.;text_
Was bedeuten diese Gesetze für meinen Alltag?
Zum einen schützen sie deine Privatsphäre und den Umgang mit sensiblen, persönlichen Daten. Jedoch nur, bis wir zu ihrer Preisgabe einwilligen. Und das tun wir meist viel zu unbedacht. Nicht umsonst werden Daten in etlichen Artikeln als “Öl des 21. Jahrhunderts” betitelt. Es bleibt also eine große Eigenverantwortung bestehen: Wir selbst müssen darauf achten, wie wir unsere Daten verwalten und preisgeben.;;;;;;;;
Daily Lections;Blippy;0;-99;1;0;text_Teilst du gerne Informationen mit deinen Bekannten? Ja? Und wie sieht es mit deinen Einkäufen über deine Kreditkarte aus? Wohl eher nicht. Aber genau das macht das Tool >Blippy<.;text_Meldet man sich bei dem Dienst an, wird man zunächst nach seiner Kreditkartennummer und Zugangsdaten zu verschiedenen Online Shops (bspw. Amazon) gefragt. Danach werden alle getätigten Einkäufe auf der Website veröffentlicht. Und warum das Ganze?;text_über die Kommentarfunktion können andere Nutzer den Einkauf bewerten. Z.B., ob das Schnäppchen wirklich eins war. Oder sie können Glückwunsch und Mitleid bekunden. Wir finden: Ziemlich absurd (und in keinster Weise Privatsphäre tauglich)!;;;;;;;;;
Daily Lections;Buchempfehlung: Das Joshua-Profil;0;-99;1;0;text_Das Joshua-Profil von Sebastian Fitzek -lb- Der erfolglose Schriftsteller Max ist ein gesetzestreuer Bürger. Anders als sein Bruder Cosmo, der in der Sicherheitsverwahrung einer psychiatrischen Anstalt sitzt, hat Max sich noch niemals im Leben etwas zuschulden kommen lassen.;text_Doch in wenigen Tagen wird er eines der entsetzlichsten Verbrechen begehen, zu denen ein Mensch überhaupt fähig ist. Nur, dass er heute noch nichts davon weiß ... im Gegensatz zu denen, die ihn töten wollen, bevor es zu spät ist.;text_Viele Unternehmen erstellen Benutzerprofile ihrer Kunden für die verschiedensten Anwendungsfälle. Aber was, wenn diese Fälle auf einmal gefährlich werden? Ein spannender Thriller, der mit einem Paukenschlag darauf aufmerksam macht, welche Daten über uns gesammelt werden und wie diese genutzt werden können.;;;;;;;;;
Daily Lections;Buchempfehlung: Inside Wikileaks;0;-99;1;0;text_Inside Wikileaks: Meine Zeit bei der gefährlichsten Website der Welt von Daniel Domscheit-Berg -lb-
Das Buch ist eine Autobiografie eines ehemaligen Mitarbeiters von Wikileaks, der unter dem Pseudonym Daniel Schmitt auch als Sprecher der Website auftrat.;text_Es behandelt viele verschiedene Einblicke in die Zeit des Autors, während er bei Wikileaks tätig war und erstreckt sich von moralischen Konflikten bis hin zur Gefahr die von Wikileaks für seine Whistleblower ausgeht bis hin zur Gefahr die Wikileaks nach Außen darstellt.
Das Buch wurde auch teilweise verfilmt im gleichnamigen Film >Inside Wikileaks - Die fünfte Gewalt< und ein Blick in das eine oder andere lohnt sich defintiv.;;;;;;;;;;
Daily Lections;Edward Snowden;0;-99;1;0;text_Ein Whistleblower der, auch heute immer wieder, in aller Munde ist. Bekannt wurde der ehemalige CIA Mitarbeiter durch seine Enthüllungen von Spionage- und Überwachungstätigkeiten von Geheimdiensten weltweit. Er gab geheime Informationen an einen Journalisten vom The Guardian weiter, welcher diese nach und nach in Teilen veröffentlichte.;text_Interessant ist vor allem seine Motivation, die Informationen zu teilen. >Ich möchte nicht in einer Welt leben, in der alles, was ich tue und sage, aufgezeichnet wird. Solche Bedingungen bin ich weder bereit zu unterstützen, noch will ich unter solchen leben.< Außerdem erachtet er die Arbeit der Geheimdienste als gefährlicher, als das was sie mit ihrem Vorgehen vermeintlich verhindern wollen/würden.
;text_Wir empfehlen: https://theintercept.com/2016/03/30/edward-snowden-noam-chomsky-glenn-greenwald-a-conversation-on-privacy/;;;;;;;;;
Daily Lections;Glenn Greenwald;0;-99;1;0;text_Glenn Greenwald ist Journalist. Er arbeitete 2013 zusammen mit Edward Snowden an der Veröffentlichung geheimer Informationen verschiedener Geheimdienste, insbesondere der NSA. Seine Aufbereitung wurde im The Guardian zusammen mit einem Interview Snowdens veröffentlicht und seither zählt er als einer der Hauptakteure in diesem Zusammenhang.;text_Er ist Mitgründer des Online Mediums The Intercept, das sich hauptsächlich mit einer Weiterverarbeitung der Daten von Snowden beschäftigt. The Intercept hat es sich zur Aufgabe gemacht, die Pressefreiheit zu wahren und bearbeitet vor allem riskante Themen wie Korruption, Verletzung von Bürgerrechten sowie Justizmissbrauch.;;;;;;;;;;
Daily Lections;Hillary Clintons E-Mail Affaire;0;-99;2;0;text_Sie hat die Wahl verloren. Viele Menschen aus der ganzen Welt bedauern dies. Ein vermeintlicher Hauptgrund, dass Hillary Clinton nicht die neue Präsidentin der Vereinigten Staaten von Amerika wird, ist wahrscheinlich die E-Mail Affaire. Aber was verbirgt sich eigentlich dahinter und warum ist es so relevant?;text_Als Außenministerin hat Hillary Clinton eine private E-Mail Adresse verwendet, um zu kommunizieren. Auch für ihr Amt. Ein Problem ist das, da die E-Mails sogar von einem privaten Server kommen, dass nicht ausgeschlossen werden kann, dass sie so relevante Informationen verheimlichen kann.;text_Wären die E-Mails über einen behördlichen Server gelaufen, könnte sichergestellt werden, dass nichts unrechtes mit den Mails passiert ist. Dies ist aber nicht der Fall. Doch direkt angreifbar macht sich Clinton damit auch nicht, denn während ihrer Amtszeit gab es noch kein verbindliches Gesetz zur Offenlegung der Kommunikation, lediglich eine Übermittlung zur externen Sicherung an die Behörde war verpflichtend.;text_ Im Wahlkampf haben es sich vor allem politische Gegner zur Aufgabe gemacht, diese E-Mails zu durchsuchen um kritisches Material aufzuspüren. Wikileaks zum Beispiel veröffentlichte ihre Mails und machte sie so öffentlich zugänglich. Im Wahlkampf plädierte Trump dagegen immer wieder, er würde alles von sich preisgeben und kritisierte Clinton für ihr >Vergehen< hart.;;;;;;;;
Daily Lections;Julian Assange;0;-99;1;0;text_Julian Assange ist ein Name, den man vor allem mit einem verbindet: Wikileaks.-lb- Assange ist Australier, lebt aber zur Zeit in London in der Botschaft von Ecuador. Dort hat er Mitte 2012 um politisches Asyl gebeten, da er von England an Schweden ausgeliefert worden wäre, nachdem dort Vergewaltigungsvorwürfe gegen ihn erhoben wurden.;text_Auch in den USA gibt es einen Haftbefehl gegen ihn, ein weiterer Grund weshalb er sich politisches Asyl sicherte. Die USA stufen ihn als Bedrohung der nationalen Sicherheit ein. Dies ist dem geschuldet, dass Assange zusammen mit Wikileaks viele geheime Dokumente veröffentlicht hat, insbesondere solche der US Armee und - Behörden.;text_Viele diese Dokumente enthielten kritische Inhalte zum Thema Krieg im  Irak und in Afghanistan. Als politischer Aktivist vertritt er Transparenz, Verantwortung und Gerechtigkeit.;;;;;;;;;
Daily Lections;Noam Chomsky;0;-99;1;0;text_Mit Noam Chomsky schließt sich der Kreis um die Personen, die an der Debatte >A Conversation on Privacy< teilgenommen haben. Wenn du dir das Video angeschaut hast, das wir zu Edward Snowden empfohlen haben, bist du bestens vorbereitet. Noam Chomsky hat an dieser Gesprächsrunde ebenfalls teilgenommen, ebenso wie Glenn Greenwald.;text_ Die Themen dieser Diskussion lagen auf dem Spagat zwischen nationaler Sicherheit und dem Eingriff von Regierungen in die Privatsphäre seiner Bürger. Was hat Chomsky damit zu tun?;text_Noam Chomsky ist ein sehr populärer Linguist und hat unter anderem mit seiner Theorie der Universalsprache einige Lehren ins wanken gebracht, insbesondere den Behaviorismus. Er ist ein bekennender Gegner der US-Politik. Insbesondere ist er sogar bei der CIA aktenkundig, da er sehr offen mit seiner liberalen Meinung um geht.;;;;;;;;;
Daily Lections;Open Source;0;-99;1;0;text_Bestimmt hast du schon einmal davon gehört: das Betriebssystem Android ist Open Source. -lb-
